{
  "schema_version": "0.1",
  "context": {
    "title": "Rumba Cha Cha",
    "artist": "Grupo Kual?",
    "isrc": "USAGX0508809",
    "album": "Los Reyes de la Cumbia Sonidera (En México)",
    "label": "AVA Records",
    "year": "2004",
    "genre": "Latino",
    "styles": ["Cumbia", "Cumbia Sonidera"],
    "personnel": [],
    "signature": "güira scrape + accordion/teclado vamp (sonidera sound-system cumbia)",
    "instruments_raw": ["teclado", "güira/guacharaca", "congas", "bombo/tambora", "cowbell", "bass"],
    "recognizer": "shazam",
    "confidence": "medium",
    "source": ["shazam", "genre-convention", "audio"]
  },

  "meta": {
    "tempo_bpm": 97.5,
    "setcpm": 24.375,
    "key": "F",
    "mode": "major",
    "feel": "straight",
    "bars": 8,
    "key_sources": ["MIR chroma (Krumhansl-Schmuckler)", "bassline pyin corroboration"]
  },

  "harmony": {
    "progression": ["F", "F", "F", "F", "Eb", "Eb", "Bb", "F"],
    "per": "bar",
    "voicing": "I - bVII - IV - I (classic cumbia); accordion struck on offbeats"
  },

  "parts": [
    {
      "id": "accordion",
      "role": "lead",
      "instrument": { "name": "teclado (keyboard emulating accordion)", "strudel_sound": "gm_accordion", "resolvability": "proxy" },
      "signals": {
        "doc_confidence": "low",
        "timbre_signature": true,
        "resolvability": "proxy",
        "transcription_confidence": "medium",
        "separation": { "isolated": true, "energy_share": 0.3, "centroid_hz": 1600, "bleed": "medium", "stem": "htdemucs_6s: guitar/other" }
      },
      "candidate_modes": [
        { "mode": "proxy", "feasible": true, "note": "no teclado voice; gm_accordion/gm_bandoneon play the same melodic role" },
        { "mode": "sample", "feasible": true, "note": "isolates, but polyphonic vamp — proxy voicing is cleaner + steerable" }
      ],
      "chosen_route": { "mode": "proxy", "rationale": "role maps well to accordion; a voiced synth follows the chords and is easier to place in the mix than a sampled polyphonic vamp", "overridable": true },
      "render": {
        "proxy": { "sound": "gm_bandoneon", "pattern": "chord(\"<F F F F Eb Eb Bb F>\").voicing().sound(\"gm_bandoneon\").struct(\"~ x ~ x\").gain(0.5)", "gain": 0.5, "orbit": 1 }
      },
      "provenance": { "instrument": ["genre", "audio"], "notes": ["shazam:sonidera"], "stem": "htdemucs_6s guitar" }
    },

    {
      "id": "guira",
      "role": "perc",
      "instrument": { "name": "güira / guacharaca (metal scraper)", "strudel_sound": "guiro", "resolvability": "proxy" },
      "signals": {
        "doc_confidence": "low",
        "timbre_signature": true,
        "resolvability": "proxy",
        "transcription_confidence": "na",
        "separation": { "isolated": true, "energy_share": 0.2, "centroid_hz": 8216, "onset_count": 267, "bleed": "low", "stem": "drumnmf/3_snd.wav" }
      },
      "candidate_modes": [
        { "mode": "proxy", "feasible": true, "note": "guiro sample approximates but loses the continuous chu-chuchu scrape character" },
        { "mode": "sample", "feasible": true, "note": "NMF voice 3 isolates cleanly (8216Hz); signature scrape — loop the real thing" }
      ],
      "chosen_route": { "mode": "sample", "rationale": "defining, un-clonable continuous scrape that isolates cleanly as its own NMF voice; proxy guiro loses the character -> chop the real loop", "overridable": true },
      "render": {
        "sample": { "sample_ref": "kual_guira_1bar.wav", "chop_or_loop": "chop", "n": 16, "pattern": "samples('http://localhost:8000/'); s(\"kual_guira_1bar\").chop(16).gain(\"0.49 0.16 0.54 0.21 0.21 1 0.62 0.38 0.1 0.46 0.5 0.17 0.62 0.89 0.24 0.19\")", "gain": 0.6, "orbit": 3, "source_stem": "mir/drumnmf/3_snd.wav", "local_only": true }
      },
      "provenance": { "instrument": ["genre", "audio"], "notes": [], "stem": "drumnmf/3_snd.wav (8216Hz)" }
    },

    {
      "id": "congas",
      "role": "perc",
      "instrument": { "name": "congas (tumbao)", "strudel_sound": "conga", "resolvability": "exact" },
      "signals": {
        "doc_confidence": "low", "timbre_signature": false, "resolvability": "exact", "transcription_confidence": "high",
        "separation": { "isolated": true, "energy_share": 0.25, "centroid_hz": 5713, "onset_count": 60, "bleed": "low", "stem": "drumnmf/2_snd.wav" }
      },
      "candidate_modes": [
        { "mode": "reproduce", "feasible": true, "note": "native conga sample + folded struct pattern (the 'a' of each beat)" },
        { "mode": "sample", "feasible": true, "note": "possible, but the conga sample is faithful enough" }
      ],
      "chosen_route": { "mode": "reproduce", "rationale": "Strudel has a native conga sample that matches; folded onset pattern reproduces the tumbao cleanly", "overridable": true },
      "render": {
        "reproduce": { "sound": "conga", "pattern": "s(\"conga\").struct(\"~ ~ ~ x  ~ ~ ~ ~  x ~ x ~  x ~ ~ ~\").gain(0.5)", "gain": 0.5, "orbit": 3 }
      },
      "provenance": { "instrument": ["genre", "audio"], "notes": [], "stem": "drumnmf/2_snd.wav" }
    },

    {
      "id": "bombo",
      "role": "drums",
      "instrument": { "name": "bombo / tambora", "strudel_sound": "bd", "resolvability": "proxy" },
      "signals": {
        "doc_confidence": "low", "timbre_signature": false, "resolvability": "proxy", "transcription_confidence": "high",
        "separation": { "isolated": true, "energy_share": 0.15, "centroid_hz": 3471, "onset_count": 16, "bleed": "low", "stem": "drumnmf/1_snd.wav (sparse=bombo)" }
      },
      "candidate_modes": [
        { "mode": "reproduce", "feasible": true, "note": "bd (+ rim for the wooden palo) with the gated 2-hit pattern" }
      ],
      "chosen_route": { "mode": "reproduce", "rationale": "sparse low-body hit maps fine to bd; gated struct reproduces the offbeat accent", "overridable": true },
      "render": {
        "reproduce": { "sound": "bd", "pattern": "s(\"bd\").struct(\"~ x ~ ~ ~ ~ ~ ~ ~ x ~ ~ ~ ~ ~ ~\").gain(0.7)", "gain": 0.7, "orbit": 3 }
      },
      "provenance": { "instrument": ["genre", "audio"], "notes": [], "stem": "drumnmf/1_snd.wav" }
    },

    {
      "id": "bass",
      "role": "bass",
      "instrument": { "name": "electric/synth bass (root-fifth pump)", "strudel_sound": "gm_synth_bass_1", "resolvability": "exact" },
      "signals": {
        "doc_confidence": "low", "timbre_signature": false, "resolvability": "exact", "transcription_confidence": "high",
        "separation": { "isolated": true, "energy_share": 0.2, "centroid_hz": 180, "bleed": "low", "stem": "bass.wav" }
      },
      "candidate_modes": [
        { "mode": "reproduce", "feasible": true, "note": "pyin gave the exact f2/c2/c3 octave-pop pump" }
      ],
      "chosen_route": { "mode": "reproduce", "rationale": "clean transcription of the boom-chika pump; generic role", "overridable": true },
      "render": {
        "reproduce": { "sound": "gm_synth_bass_1", "pattern": "note(\"f2 ~ ~ ~ c2 ~ c3 ~ f2 ~ ~ ~ c2 ~ c3 ~\").sound(\"gm_synth_bass_1\").gain(0.65)", "gain": 0.65, "orbit": 0 }
      },
      "provenance": { "instrument": ["audio"], "notes": ["transcribe_stem"], "stem": "bass.wav" }
    }
  ],

  "render_target": {
    "host": "strudel.cc",
    "setcpm": 24.375,
    "master_gain": 0.8,
    "sample_server": "http://localhost:8000/"
  }
}
